[
  {
    "attentionReasons": [
      "connector-evidence",
      "external-context-failure"
    ],
    "attentionScore": 1.0,
    "body": "Scenario `calcom.cancelled_booking_uid_cannot_be_replayed_as_public_reschedule`: Cancelled booking UID replay through public booking route is rejected.\n\nFingerprint: `bayesilisk:f6a7ea16be20efea`\n\nClassification: `breakage.context-observed`\n\nIssue readiness: `ready-for-issue`\n\nExpected: semantic status `409`\n\nObserved: semantic status `200`\n\nRoute: `create-booking -> cancel-booking -> open-public-booking-route`\n\nTarget URL: `http://localhost:3000/user-0-1779213056583/30-min`\n\nActor role: `attendee`\n\nSource context:\n- apps/web/playwright/bayesilisk-probes.e2e.ts | Cancelled booking UID replay through public booking route is rejected | Cal.com connector action graph creates a booking, cancels it, then replays the cancelled booking UID through the public booking route as rescheduleUid.\n\nEvidence source: app-provided connector observation; Bayesilisk only compares deterministic observed facts.\n\nArtifacts:\n",
    "classification": "breakage.context-observed",
    "dedupeKey": "bayesilisk:f6a7ea16be20efea:calcom.cancelled_booking_uid_cannot_be_replayed_as_public_reschedule",
    "dedupeState": "new",
    "fingerprint": "bayesilisk:f6a7ea16be20efea",
    "invariantId": "calcom.cancelled_booking_uid_cannot_be_replayed_as_public_reschedule",
    "issuePayloadSource": "verifiedByBayesilisk",
    "issueReadiness": "ready-for-issue",
    "labels": [
      "bayesilisk",
      "usa"
    ],
    "minimizedReproducer": null,
    "modelProvenance": null,
    "originalScenario": {
      "expectedStatus": 409,
      "observedStatus": 200,
      "route": "create-booking -> cancel-booking -> open-public-booking-route",
      "source": "microsoft-playwright",
      "targetUrl": "http://localhost:3000/user-0-1779213056583/30-min"
    },
    "posteriorMode": "highest-fault-probability",
    "riskScore": 0.99,
    "scenarioId": "external.11",
    "title": "Bayesilisk context-observed: Cancelled booking UID replay through public booking route is rejected"
  },
  {
    "attentionReasons": [
      "connector-evidence",
      "external-context-failure"
    ],
    "attentionScore": 1.0,
    "body": "Scenario `calcom.dynamic_booking_unknown_reschedule_uid_must_not_open_booking_flow`: Dynamic booking page has a passing valid reschedule flow: stale id for rescheduleUid.\n\nFingerprint: `bayesilisk:0f97077a61e6fdea`\n\nClassification: `breakage.context-observed`\n\nIssue readiness: `ready-for-issue`\n\nExpected: semantic status `404`\n\nObserved: semantic status `200`\n\nRoute: `/{username}+{username}?rescheduleUid={rescheduleUid}`\n\nTarget URL: `http://localhost:3000/user-0-1779213043144+bayesilisk-dynamic-UI91W5-0-1779213043385?rescheduleUid=stale-rescheduleUid`\n\nActor role: `attendee`\n\nSource context:\n- apps/web/playwright/dynamic-booking-pages.e2e.ts | Dynamic booking page has a passing valid reschedule flow | Cal.com source signal: dynamic booking tests use rescheduleUid for a valid group booking reschedule; stale or unknown reschedule context should not silently become a new group booking.\n\nEvidence source: app-provided connector observation; Bayesilisk only compares deterministic observed facts.\n\nArtifacts:\n",
    "classification": "breakage.context-observed",
    "dedupeKey": "bayesilisk:0f97077a61e6fdea:calcom.dynamic_booking_unknown_reschedule_uid_must_not_open_booking_flow",
    "dedupeState": "new",
    "fingerprint": "bayesilisk:0f97077a61e6fdea",
    "invariantId": "calcom.dynamic_booking_unknown_reschedule_uid_must_not_open_booking_flow",
    "issuePayloadSource": "verifiedByBayesilisk",
    "issueReadiness": "ready-for-issue",
    "labels": [
      "bayesilisk",
      "usa"
    ],
    "minimizedReproducer": null,
    "modelProvenance": null,
    "originalScenario": {
      "expectedStatus": 404,
      "observedStatus": 200,
      "route": "/{username}+{username}?rescheduleUid={rescheduleUid}",
      "source": "microsoft-playwright",
      "targetUrl": "http://localhost:3000/user-0-1779213043144+bayesilisk-dynamic-UI91W5-0-1779213043385?rescheduleUid=stale-rescheduleUid"
    },
    "posteriorMode": "highest-fault-probability",
    "riskScore": 0.99,
    "scenarioId": "external.10",
    "title": "Bayesilisk context-observed: Dynamic booking page has a passing valid reschedule flow: stale id for rescheduleUid"
  },
  {
    "attentionReasons": [
      "connector-evidence",
      "external-context-failure"
    ],
    "attentionScore": 1.0,
    "body": "Scenario `calcom.dynamic_booking_unknown_reschedule_uid_must_not_open_booking_flow`: Dynamic booking page has a passing valid reschedule flow: unknown id for rescheduleUid.\n\nFingerprint: `bayesilisk:97a5026d569853f2`\n\nClassification: `breakage.context-observed`\n\nIssue readiness: `ready-for-issue`\n\nExpected: semantic status `404`\n\nObserved: semantic status `200`\n\nRoute: `/{username}+{username}?rescheduleUid={rescheduleUid}`\n\nTarget URL: `http://localhost:3000/user-0-1779213042539+bayesilisk-dynamic-98pVva-0-1779213042781?rescheduleUid=missing-rescheduleUid`\n\nActor role: `attendee`\n\nSource context:\n- apps/web/playwright/dynamic-booking-pages.e2e.ts | Dynamic booking page has a passing valid reschedule flow | Cal.com source signal: dynamic booking tests use rescheduleUid for a valid group booking reschedule; stale or unknown reschedule context should not silently become a new group booking.\n\nEvidence source: app-provided connector observation; Bayesilisk only compares deterministic observed facts.\n\nArtifacts:\n",
    "classification": "breakage.context-observed",
    "dedupeKey": "bayesilisk:97a5026d569853f2:calcom.dynamic_booking_unknown_reschedule_uid_must_not_open_booking_flow",
    "dedupeState": "new",
    "fingerprint": "bayesilisk:97a5026d569853f2",
    "invariantId": "calcom.dynamic_booking_unknown_reschedule_uid_must_not_open_booking_flow",
    "issuePayloadSource": "verifiedByBayesilisk",
    "issueReadiness": "ready-for-issue",
    "labels": [
      "bayesilisk",
      "usa"
    ],
    "minimizedReproducer": null,
    "modelProvenance": null,
    "originalScenario": {
      "expectedStatus": 404,
      "observedStatus": 200,
      "route": "/{username}+{username}?rescheduleUid={rescheduleUid}",
      "source": "microsoft-playwright",
      "targetUrl": "http://localhost:3000/user-0-1779213042539+bayesilisk-dynamic-98pVva-0-1779213042781?rescheduleUid=missing-rescheduleUid"
    },
    "posteriorMode": "highest-fault-probability",
    "riskScore": 0.99,
    "scenarioId": "external.9",
    "title": "Bayesilisk context-observed: Dynamic booking page has a passing valid reschedule flow: unknown id for rescheduleUid"
  },
  {
    "attentionReasons": [
      "connector-evidence",
      "external-context-failure"
    ],
    "attentionScore": 1.0,
    "body": "Scenario `calcom.private_link_unknown_reschedule_uid_must_not_open_booking_flow`: Private booking link resolves rescheduleUid into booking context: stale id for rescheduleUid.\n\nFingerprint: `bayesilisk:bfe8eaef0fc1701c`\n\nClassification: `breakage.context-observed`\n\nIssue readiness: `ready-for-issue`\n\nExpected: semantic status `404`\n\nObserved: semantic status `200`\n\nRoute: `/d/{hashedLink}/{eventType}?rescheduleUid={rescheduleUid}`\n\nTarget URL: `http://localhost:3000/d/6sKJe6EDHb5P5kshhFKLEp/30-min?rescheduleUid=stale-rescheduleUid`\n\nActor role: `attendee`\n\nSource context:\n- apps/web/lib/d/[link]/[slug]/getServerSideProps.tsx | Private booking link resolves rescheduleUid into booking context | Cal.com source signal: private booking link SSR validates the hashed link, then calls getBookingForReschedule when rescheduleUid is present before rendering booking props.\n\nEvidence source: app-provided connector observation; Bayesilisk only compares deterministic observed facts.\n\nArtifacts:\n",
    "classification": "breakage.context-observed",
    "dedupeKey": "bayesilisk:bfe8eaef0fc1701c:calcom.private_link_unknown_reschedule_uid_must_not_open_booking_flow",
    "dedupeState": "new",
    "fingerprint": "bayesilisk:bfe8eaef0fc1701c",
    "invariantId": "calcom.private_link_unknown_reschedule_uid_must_not_open_booking_flow",
    "issuePayloadSource": "verifiedByBayesilisk",
    "issueReadiness": "ready-for-issue",
    "labels": [
      "bayesilisk",
      "usa"
    ],
    "minimizedReproducer": null,
    "modelProvenance": null,
    "originalScenario": {
      "expectedStatus": 404,
      "observedStatus": 200,
      "route": "/d/{hashedLink}/{eventType}?rescheduleUid={rescheduleUid}",
      "source": "microsoft-playwright",
      "targetUrl": "http://localhost:3000/d/6sKJe6EDHb5P5kshhFKLEp/30-min?rescheduleUid=stale-rescheduleUid"
    },
    "posteriorMode": "highest-fault-probability",
    "riskScore": 0.99,
    "scenarioId": "external.8",
    "title": "Bayesilisk context-observed: Private booking link resolves rescheduleUid into booking context: stale id for rescheduleUid"
  },
  {
    "attentionReasons": [
      "connector-evidence",
      "external-context-failure"
    ],
    "attentionScore": 1.0,